{
  "schema": "mactech.collector.run-manifest.v1",
  "version": "1.0.0",
  "run_id": "20260305T074916Z-a00d8782",
  "organization_id": "b6e1b0e2-c589-4c72-8cd2-43de8619fced",
  "boundary_id": "e2a587cf-fd7d-4ce6-b224-a56db31fa52d",
  "collector": {
    "name": "cui-evidence-collector",
    "version": "2.0.0",
    "git_commit": "<commit>",
    "command": "powershell -File Collect-Cui-Evidence-v2.ps1 -OutDir C:\\evidence\\runs\\<run_id> -BoundaryId <uuid> -OrgId <uuid>",
    "toolchain": {
      "powershell": "7.x",
      "python": "3.x",
      "az": "2.x"
    }
  },
  "host": {
    "hostname": "CUI-VAULT-01",
    "os": "Windows Server 2025 Datacenter",
    "cloud": {
      "provider": "azure",
      "environment": "gov"
    },
    "tags": {
      "enclave": "cui"
    }
  },
  "timing": {
    "started_at": "2026-03-05T07:49:16Z",
    "ended_at": "2026-03-05T07:49:16Z",
    "duration_seconds": 123.4
  },
  "summary": {
    "checks_total": 110,
    "pass": 104,
    "fail": 4,
    "warn": 2,
    "error": 0,
    "na": 0,
    "overall_status": "fail"
  },
  "artifacts": {
    "outputs_root": "C:\\evidence\\runs\\20260305T074916Z-a00d8782",
    "control_results_path": "C:\\evidence\\runs\\20260305T074916Z-a00d8782\\control_results.json",
    "evidence_index_path": "C:\\evidence\\runs\\20260305T074916Z-a00d8782\\evidence_index.json"
  },
  "notes": [
    "Raw evidence remains on-vault; control plane stores metadata, hashes, and redacted excerpts only."
  ]
}